The Washington Post Retweeted;@thefix;2021-12-21T20:49:33.000Z;Former president Donald Trump keeps encouraging his supporters to get vaccinated against the coronavirus …;21;24
The Washington Post;@washingtonpost;2021-12-21T20:47:23.000Z;Gift giving: Is it really the thought that counts? Psychologists weigh in. Many gift-giving cliches are well-meaning, but experts say focusing too much on them can potentially lead givers astray.;7;10
The Washington Post;@washingtonpost;2021-12-21T18:38:10.000Z;"Fauci says Fox News host Jesse Watters 'should be fired’ for ‘ambush’ and ‘kill shot’ comments The Fox host was referring to confrontational interviews in comments at conservative conference but leaned hard on violent imagery: ""Boom! He is dead!""";241;284
The Washington Post;@washingtonpost;2021-12-21T18:22:43.000Z;Voting rights reform moves to the front of the line after Build Back Better blows up Might Manchin be more helpful now on voting rights?;31;29
The Washington Post;@washingtonpost;2021-12-21T18:15:04.000Z;Holiday cookie generator Find the best holiday cookie recipes for every taste and occasion.;7;28
The Washington Post;@washingtonpost;2021-12-21T18:15:21.000Z;Whether you’re looking for something gluten free, chocolate, no bake or all three, the recipes within the generator are endless. 0:;3;7
The Washington Post;@washingtonpost;2021-12-21T18:08:34.000Z;Manchin to kids in poverty: Let them eat cake Manchin may not care about poor children, but he might not like getting blamed for an economic slump.;116;155
The Washington Post;@washingtonpost;2021-12-21T17:57:05.000Z;The hidden, ugly truth behind Joe Manchin’s stance on BBB’s climate provisions An interview with a coal miners' union official about Manchin's climate stance.;62;91
The Washington Post;@washingtonpost;2021-12-21T17:43:05.000Z;Walgreens and CVS struggle against ‘unprecedented’ holiday demand for home tests amid omicron surge The surge from the fast-spreading omicron variant, which has accounted for nearly three-quarters of covid-19 cases in the past week, has left Walgreens and CVS struggling to keep at-home test kits on...;40;49
The Washington Post;@washingtonpost;2021-12-21T15:38:04.000Z;Five things about omicron that I want my friends and family to know As a health reporter who’s been writing about coronavirus since early January 2020, Dan Diamond often gets questions about the pandemic. Here is his advice on approaching the holidays with the...;7;39
The Washington Post;@washingtonpost;2021-12-21T15:37:58.000Z;"Sex and the City stars ‘deeply saddened’ by Chris Noth sex assault allegations as CBS show fires... Sarah Jessica Parker, Cynthia Nixon, and Kristin Davis, who star in the reboot ""And Just Like That,"" said they supported the women who had come forward.";43;36
The Washington Post;@washingtonpost;2021-12-21T15:30:25.000Z;Three years ago, Hanan Elatr was a globe-trotting supervisor for the Emirates airlines. She was married to journalist Jamal Khashoggi and earning a salary that allowed her to support her mother and siblings. Recently, she said she fears for her life.;32;263
The Washington Post;@washingtonpost;2021-12-21T15:33:19.000Z;The new analysis provides the first indication that a UAE government agency placed the military-grade spyware on a phone used by someone in Khashoggi’s inner circle in the months before he was murdered in Istanbul by a Saudi hit team.;6;57
The Washington Post;@washingtonpost;2021-12-21T15:34:28.000Z;Elatr is haunted by the killing of her husband. Now, she has learned that a UAE agency put Pegasus spyware on her phone months before his murder.;11;62
The Washington Post;@washingtonpost;2021-12-21T15:23:54.000Z;We took Bill and Hillary Clinton’s MasterClasses. Guess who seemed more prepared. In his MasterClass, Bill Clinton teaches “inclusive leadership,” while Hillary Clinton is our instructor on “the power of resilience.”;47;29
The Washington Post;@washingtonpost;2021-12-21T15:11:40.000Z;Tuesday’s winter solstice signals brighter days ahead The solstice, marking the year’s shortest day, arrives at 10:59 a.m. Eastern time.;8;36
The Washington Post;@washingtonpost;2021-12-21T14:04:29.000Z;Angry progressives don’t want to talk about scaling back their ambitions to bring back to life some... The intense frustration emanating from the most liberal members of Congress adds an extra layer of complication for the White House and Democratic leaders who are scrambling to find a path forward to...;156;65
The Washington Post;@washingtonpost;2021-12-21T13:50:18.000Z;5 tips for how to wrap presents and create less waste Gift wrap accounts for millions of tons of waste each year. Here's how to wrap presents like a sustainability pro.;18;35
The Washington Post;@washingtonpost;2021-12-21T13:36:38.000Z;CNN hosts were threatened by man falsely insisting Trump won in 2020: ’Triggered over and over... On Monday, Robert Lemke, 36, from Bay Point, Calif., was sentenced to three years in prison after he pleaded guilty in October to threatening a journalist’s New York-based family.;78;100
The Washington Post;@washingtonpost;2021-12-21T13:21:03.000Z;"Bidens bring a new puppy to the White House ""Welcome to the White House, Commander,"" President Biden posted Monday on Twitter.";105;103
The Washington Post;@washingtonpost;2021-12-21T13:03:10.000Z;House Jan. 6 committee seeks information from GOP Rep. Perry about communications with Trump White... The Pennsylvania Republican, who objected to his state certifying Biden’s win, has emerged as the leading conduit for House GOP involved with Trump to overturn the election.;23;50
The Washington Post;@washingtonpost;2021-12-21T13:02:33.000Z;A UAE agency put Pegasus spyware on phone of Jamal Khashoggi’s wife months before his murder, new... The new analysis challenges NSO claims that the murdered journalist's wife, Hanan Elatr, 'was not a target';12;110
The Washington Post;@washingtonpost;2021-12-21T12:50:07.000Z;Donald Trump told his supporters he got a coronavirus booster shot. They booed him. The former president was doing a live interview with conservative pundit Bill O'Reilly.;395;374
The Washington Post;@washingtonpost;2021-12-21T12:37:12.000Z;Unvaccinated Houston man’s death may be first attributed to omicron in U.S. The man had underlying health conditions that made him particularly vulnerable to the coronavirus.;77;72
The Washington Post;@washingtonpost;2021-12-21T12:21:06.000Z;"Tuesday briefing: Omicron takes over; explaining the log4j vulnerability; NHL suspension; holiday... Catch up in minutes with these 7 stories.";7;18
The Washington Post;@washingtonpost;2021-12-21T09:43:36.000Z;"This retired couple spends every day of the year making Christmas toys for kids in need “My sales policy is not to collect a single penny,"" said Mike Sullivan. ""Everything we make is given away.”";14;62
The Washington Post;@washingtonpost;2021-12-21T09:26:47.000Z;"Richard Antoine White once had little more than his tuba. Now, he’s a musical pioneer. White went from the streets of Baltimore to the philharmonic. In his memoir ""I'm Possible,"" he tells the story of how he transformed his life.";6;25
The Washington Post;@washingtonpost;2021-12-21T09:10:11.000Z;"The ‘most serious’ security breach ever is unfolding right now. Here’s what you need to know. A common piece of code used by thousands of companies for years has turned out to contain one of the ""most serious"" cybersecurity risks of the Internet age. Here's what you need to know about log4j.";29;53
The Washington Post;@washingtonpost;2021-12-21T08:55:57.000Z;He was close by for three presidential assassinations. Including his dad’s. Robert Todd Lincoln was present or nearby for the assassinations of Abraham Lincoln, James Garfield and William McKinley.;8;38
The Washington Post;@washingtonpost;2021-12-21T08:39:57.000Z;Egyptian emergency court sentences three prominent prisoners to years behind bars The three men were charged with “spreading false news undermining national security.”;13;19
The Washington Post;@washingtonpost;2021-12-21T08:27:31.000Z;French police uncover 182,000 fake covid health passes Using or selling a false health pass to dodge coronavirus restrictions for restaurants, bars and public transport is punishable by five years in prison and a 75,000 euro fine.;30;109
The Washington Post;@washingtonpost;2021-12-21T08:14:26.000Z;NFL’s covid-testing plan could fuel spread, experts say, but it’s ‘where society is going’ After dozens of players tested positive last week, the league overhauled its testing strategy, saying it will no longer conduct regular testing of vaccinated players who show no signs of illness.;20;18
The Washington Post;@washingtonpost;2021-12-21T07:58:14.000Z;Los Angeles’s anger at its homeless is what’s driving Karen Bass to run for mayor Karen Bass's run for L.A. mayor is about housing the homeless and soothing the city's frustration.;18;22
The Washington Post;@washingtonpost;2021-12-21T07:46:08.000Z;"The pandemic ended big gift exchanges. Here’s what we’re doing instead. This year, Americans say they’re focusing on practical gifts — air fryers, sweaters, gift cards — for a select few: “I’m done buying stuff for the sake of buying it.""";21;29
The Washington Post;@washingtonpost;2021-12-21T04:58:57.000Z;The Supreme Court opened the door to legal vigilantism in Texas. California will use the... Maybe California’s move will lead the court to change its mind about allowing Texas’s bounty-hunter scheme.;117;613
The Washington Post;@washingtonpost;2021-12-21T04:46:39.000Z;Lead Capitol riot charge is constitutional, judges find Judge Amit Mehta is the third to rule in favor of prosecutors seeking to convict Jan. 6 participants on felony charges.;35;137
The Washington Post;@washingtonpost;2021-12-21T04:28:58.000Z;What to do when a hotel closure impacts your trip Having a Plan B is always a good idea, especially when it comes to lodging.;6;13
The Washington Post;@washingtonpost;2021-12-21T04:09:28.000Z;A violent crash, a $106 million verdict and the embrace that brought closure Ezra Ganeshananda won a $106.8 million settlement for the pain and suffering he had endured following a crash that occurred while he was working as a Maryland state trooper in 2016.;7;17
The Washington Post;@washingtonpost;2021-12-21T03:54:01.000Z;Richard Rogers, high-tech modernist who won architecture’s Pritzker Prize, dies at 88 His unorthodox, inside-out designs for the Pompidou Center in Paris and Lloyd’s insurance headquarters in London transfixed the architecture world.;7;34
The Washington Post;@washingtonpost;2021-12-21T03:45:33.000Z;Pentagon updates rules to address extremism in the military The new rules stem from revelations that military personnel and veterans were among those who attacked the U.S. Capitol on Jan. 6.;53;103
The Washington Post;@washingtonpost;2021-12-21T03:31:50.000Z;The pandemic could drive another national health crisis, GAO warns: Anxiety Behavioral health issues, including substance abuse, are up as people suffer from covid-19 related anxiety and depression, according to a new report from the Government Accountability Office.;22;30
The Washington Post;@washingtonpost;2021-12-21T03:18:15.000Z;Biden was in close contact with aide who later tested positive for covid-19, White House says The president tested negative Monday morning and will be tested again on Wednesday, White House press secretary Jen Psaki said in a statement.;45;88
The Washington Post;@washingtonpost;2021-12-21T03:17:23.000Z;NHL is first U.S. sport to halt schedule amid coronavirus surge, with stoppage starting Wednesday The league will shut down Wednesday, with the season tentatively slated to resume Monday, Dec. 27.;33;280
The Washington Post;@washingtonpost;2021-12-21T00:09:13.000Z;Trump got his booster, after Fox News goaded him to knock boosters The effort to seed vaccine skepticism, epitomized and obliged.;146;225
The Washington Post;@washingtonpost;2021-12-21T00:05:47.000Z;Covid-19 live updates: Omicron was more than 70 percent of new U.S. cases last week New York Mayor Bill de Blasio called on President Biden to invoke the Defense Production Act to provide supplies of testing kits and treatments.;34;87
The Washington Post;@washingtonpost;2021-12-21T00:05:47.000Z;We've deleted an earlier tweet that incorrectly stated the Omicron variant was 73 percent of all U.S. cases. The CDC data is for new cases.;8;27
The Washington Post;@washingtonpost;2021-12-20T23:51:39.000Z;The pop culture that influenced our columnists this year We asked our columnists to share a piece of culture that had a big impact on them this year. Here’s what they recommended.;8;11
The Washington Post;@washingtonpost;2021-12-20T23:37:52.000Z;Along Afghanistan’s ‘highway of death,’ the bombs are gone but suffering has deepened Rebuilt with U.S. tax dollars, the Kabul-Kandahar highway was intended to win the hearts and minds of Afghans. Instead, it became a war zone and a symbol of American failure.;9;17
The Washington Post;@washingtonpost;2021-12-20T23:19:17.000Z;Members of Congress want answers from Amazon on warehouse collapse The letter from more than a dozen lawmakers asks Amazon for documents and details about its policies for safety drills, storm shelters and flexible working hours during storms.;7;41
The Washington Post;@washingtonpost;2021-12-20T23:00:29.000Z;"Pelosi announces plans for ‘solemn observance’ of one-year anniversary of Jan. 6 insurrection Preparations are underway for ""a full program of events,"" including talks with historians, an opportunity for members to share their experiences, and a prayerful vigil, Pelosi said.";90;70
The Washington Post;@washingtonpost;2021-12-20T22:41:02.000Z;The U.S. is failing at rapid covid testing. This is a disgrace. The U.S. ought to provide free or inexpensive rapid coronavirus tests to anyone who wants one.;29;54
The Washington Post;@washingtonpost;2021-12-20T20:24:53.000Z;Covid could turn NBA’s Christmas showcase into a dud The league will be lucky to get one or two quality contests given that eight of the 10 teams scheduled to play Saturday have players in the health and safety protocols.;19;12
The Washington Post;@washingtonpost;2021-12-20T20:07:11.000Z;The Biden administration weighs backing Ukraine insurgents if Russia invades A problem that bedeviled the United States in Iraq and Afghanistan could be Putin's problem if he orders troops to enter Ukraine.;39;28
The Washington Post;@washingtonpost;2021-12-20T19:40:39.000Z;At closing arguments, Ghislaine Maxwell portrayed as both abuser and wrongly targeted victim Defense lawyers argue that memories can change to reflect information uncovered later.;14;58
The Washington Post;@washingtonpost;2021-12-20T19:30:00.000Z;Our food team has created a holiday cookie generator to help you find the right treat for every taste and occasion. With 359 recipes to choose from, there’s no shortage of possibilities.;4;15
The Washington Post;@washingtonpost;2021-12-20T19:25:02.000Z;Rethinking holiday plans? Ask The Post about the omicron variant and travel. Three Post reporters will answer your questions about at-home tests, masking in public and holiday travel in light of the surge in coronavirus cases.;14;14
The Washington Post;@washingtonpost;2021-12-20T17:35:38.000Z;The ‘Cowboy Cocktail’: How Wyoming became one of the world’s top tax havens The Pandora Papers show how global elite abandoned international financial centers for the secrecy afforded by Wyoming trusts, turning the state into one of the world’s top tax havens.;9;33
The Washington Post;@washingtonpost;2021-12-20T17:29:34.000Z;Doug Emhoff playing an age-old role with a new twist As historic second gentleman, Doug Emhoff serves as envoy for his much-scrutinized wife, without the political edge;11;20
The Washington Post;@washingtonpost;2021-12-20T17:11:51.000Z;Bowser reimposes indoor mask mandate as coronavirus cases surge Bowser also announced a vaccination mandate for D.C. government workers, without an option to test out.;38;74
The Washington Post Retweeted;@PostGraphics;2021-12-20T15:33:40.000Z;The Senate confirmed dozens of President Biden's nominees over the weekend. Our appointee tracker shows the late-year jump ahead of Trump's totals at this point;4;22
The Washington Post;@washingtonpost;2021-12-20T16:58:38.000Z;Schools send students home with coronavirus tests for the holidays as omicron fears lead to... Schools from California to Illinois sent the at-home tests as part of an effort to preserve in-person learning.;12;29
The Washington Post;@washingtonpost;2021-12-20T16:42:05.000Z;Trump sues New York attorney general in attempt to halt inquiry into his company Letitia James is trying to get the former president to testify under oath.;256;75
The Washington Post;@washingtonpost;2021-12-20T16:26:10.000Z;Mask-wearing on planes may be here to stay, Fauci says Fauci’s comments follow remarks from Southwest Airlines’ chief executive, who said last week before his own diagnosis of covid that masks “don’t add much, if anything, in the air cabin environment.”;40;44
The Washington Post;@washingtonpost;2021-12-20T16:21:49.000Z;New Biden rule reducing climate emissions from cars and SUVs reverses major Trump rollback The joint Environmental Protection Agency-Transportation Department regulation finalized Monday marks the president’s single biggest step to fight global warming. But Congress has stymied his most...;61;287
The Washington Post;@washingtonpost;2021-12-20T14:12:18.000Z;More than 40 House Democrats urge Treasury Department to unfreeze Afghanistan’s bank reserves The letter comes as experts warn of an increasingly dire humanitarian situation in Afghanistan.;35;56
The Washington Post;@washingtonpost;2021-12-20T13:43:12.000Z;Jury finishes first day of deliberations in trial of officer who fatally shot Daunte Wright Kimberly Potter, a former Brooklyn Center, Minn., police officer, is facing first- and second-degree manslaughter charges.;18;22
The Washington Post;@washingtonpost;2021-12-20T13:29:02.000Z;Biden has installed a significant number of judges from diverse backgrounds — now comes the hard...;40;25
The Washington Post;@washingtonpost;2021-12-20T13:16:53.000Z;Britney Spears’s songs are packed into a new storybook musical, but this kingdom needs... “Once Upon a One More Time,” about fairy-tale princesses, has its world premiere at Shakespeare Theatre Company. While it lacks finesse, lead performer Briga Heelan brings out the show’s potential.;6;6
The Washington Post;@washingtonpost;2021-12-20T13:02:12.000Z;The Kentucky tornado swept away two babies in a bathtub. They survived. The infants' grandmother placed them in a bathtub with a blanket, a pillow and a Bible.;23;89
The Washington Post;@washingtonpost;2021-12-20T12:50:44.000Z;Democratic bitterness, rage follow Manchin’s ‘no’ on Biden bill The White House says it’s still determined to pass “Build Back Better.” But recriminations were on full display, as the senator complained of being badgered, liberals accused him of betrayal — and...;84;197
The Washington Post;@washingtonpost;2021-12-20T09:49:34.000Z;Carolyn Hax: Parents are upset by news of adult daughter’s eating disorder relapse Their adult daughter recently started binging and purging again. As parents, can they “state our preferences” about her behavior in their home?;9;21
The Washington Post;@washingtonpost;2021-12-20T09:21:41.000Z;Long after the courts shut down for covid, the pain of delayed justice lingers Courts nationwide have been swamped by a backlog of cases that has no end in sight.;8;31
The Washington Post;@washingtonpost;2021-12-20T08:23:05.000Z;Germany faces pressure to risk its energy future to get back at Putin. That’s a tough... Less than two weeks into the new German chancellor’s tenure, the fate of the Nord Stream 2 pipeline is an early test of German leadership in a post-Angela Merkel world.;21;27
The Washington Post;@washingtonpost;2021-12-20T08:03:54.000Z;‘Spider-Man: No Way Home’ post-credits scenes, explained In the “Spider-Man: No Way Home” post-credits scenes, an unexpected rival appears in Tom Holland's spidey world.;12;19
The Washington Post;@washingtonpost;2021-12-20T07:33:37.000Z;Holiday gifts for the political players Some last-minute shopping ideas.;10;16
The Washington Post;@washingtonpost;2021-12-20T07:05:45.000Z;Flying high on the Australian charts: An album of endangered birdsongs The squeaks and squawks of 53 of Australia's most threatened birds were at one point more popular than Taylor Swift.;11;33
The Washington Post;@washingtonpost;2021-12-20T06:37:46.000Z;Distinguished pol of the week: What Democrats can learn from Liz Cheney For some brilliant public rhetoric, we can say, well done, Rep. Cheney.;64;60
The Washington Post;@washingtonpost;2021-12-20T06:08:05.000Z;Carolyn Hax: How to feel more affection for ‘very annoying’ 14-year-old son A parent feels guilty about their frustration with their 14-year-old son who “seems to adore one thing: contradicting every statement I make.”;11;27
The Washington Post;@washingtonpost;2021-12-20T02:06:31.000Z;Omicron is fueling lockdowns in some countries just as others start to loosen restrictions The Netherlands is imposing a snap lockdown. Meanwhile, Australia has loosened nearly all coronavirus measures.;23;33
The Washington Post;@washingtonpost;2021-12-20T01:38:01.000Z;From charm offensive to scorched earth: How Biden’s fragile alliance with Manchin unraveled Some Democrats worry that a rift between the president and the key senator could imperil other White House priorities.;59;34
The Washington Post;@washingtonpost;2021-12-20T01:11:37.000Z;The White House’s extraordinary, furious statement about Joe Manchin White House press secretary Jen Psaki tore into Sen. Joe Manchin III (D-W. Va.) for abruptly ending negotiations on Build Back Better.;187;208
The Washington Post;@washingtonpost;2021-12-20T00:41:06.000Z;D.C. third-graders were made to reenact episodes from the Holocaust A school staffer member made students pretend to kill each other in mass graves during library class.;66;120
The Washington Post;@washingtonpost;2021-12-20T00:23:01.000Z;Pressure grows for Biden to ease sanctions as hunger, poverty soar in Afghanistan Some lawmakers and experts push for money to flow. Others warn it would end up with the Taliban.;29;49
The Washington Post;@washingtonpost;2021-12-19T23:37:41.000Z;Lawmakers, business leaders begin to raise alarms about dwindling federal aid, as omicron cases... Over the course of the nearly two-year pandemic, Congress has committed more than $5 trillion toward combating the contagion. But some of the most significant programs to keep businesses afloat and...;64;35
The Washington Post;@washingtonpost;2021-12-19T23:13:49.000Z;Hong Kong voters stay away from ‘patriots-only’ election in rejection of Beijing’s control Turnout was the lowest in any poll since Hong Kong’s handover to China in 1997, a repudiation of Beijing’s crackdown on the pro-democracy movement.;41;152
The Washington Post;@washingtonpost;2021-12-19T22:40:38.000Z;Sens. Warren and Booker test positive for coronavirus Both said they are experiencing only mild symptoms.;202;263
The Washington Post;@washingtonpost;2021-12-19T19:19:41.000Z;The lasting images of 2021 These are the most memorable photos of 2021 as chosen by Washington Post photography editors, and interviews with the photographers who made the images.;4;20
The Washington Post;@washingtonpost;2021-12-19T19:19:12.000Z;The finest athletes on the planet gathered despite the pandemic and demonstrated what people can do when they press themselves to the max. Exceedingly adventuresome souls launched themselves into space.;6;15
The Washington Post;@washingtonpost;2021-12-19T19:08:10.000Z;"The images of 2021 tell a complex yet dramatic story, Marc Fisher writes. There was fire and there was rain; the West burned and New York flooded. The Earth itself seemed to confront people with one test after another.";40;92
The Washington Post;@washingtonpost;2021-12-19T19:15:07.000Z;Halfway across the world, in Afghanistan, a place where turmoil is a constant, Americans mired in a decades-old conflict finally went home, and even that long-sought, long-awaited relief turned chaotic, divisive and deadly.;12;15
The Washington Post;@washingtonpost;2021-12-19T19:15:07.000Z;Yet through it all, the people on this planet did wondrously good things, too. Scientists concocted almost magical elixirs, vaccines and treatments that allowed many to edge back into lives they’d put on a maddeningly long hold.;6;14
The Washington Post;@washingtonpost;2021-12-19T18:49:12.000Z;The alternative to Supreme Court enlargement is surrender Why Elizabeth Warren’s endorsement of court enlargement matters.;14;46
The Washington Post;@washingtonpost;2021-12-19T18:49:03.000Z;"Manchin says he ‘cannot vote’ for Democrats’ $2 trillion spending package, drawing sharp White... ""I cannot vote to continue with this piece of legislation, I just can’t,” Manchin said on ""Fox News Sunday,"" citing the impacts of rising prices, the arrival of a new coronavirus variant and other...";318;323
The Washington Post;@washingtonpost;2021-12-19T18:18:30.000Z;Tiger Woods returns, flashing moments of his old form and grimaces of his new reality It was a decidedly low-key return for the 15-time major winner, who is 10 months removed from horrific leg injuries suffered in a single-car crash.;8;31
