The Washington Post;@washingtonpost;2021-12-23T21:03:02.000Z;What is redistricting? Redistricting is underway around the country, and it will continue to receive intense scrutiny ahead of the 2022 midterm elections.;14;27
The Washington Post;@washingtonpost;2021-12-23T20:57:05.000Z;President Biden is failing on covid-19 The White House is playing catch-up and doing damage control as omicron rages across the country.;600;115
The Washington Post;@washingtonpost;2021-12-23T20:35:00.000Z;Pregnancy apps have become a battleground of vaccine misinformation How the What To Expect site managed to clean up its big anti-vaccine problem;25;34
The Washington Post;@washingtonpost;2021-12-23T20:08:03.000Z;In highly vaccinated New England, hospitals are under unprecedented strain as coronavirus surges States such as Vermont, New Hampshire and Maine have experienced record numbers of cases and hospitalizations.;47;60
The Washington Post;@washingtonpost;2021-12-23T19:50:01.000Z;Omicron pulls workers back to the eye of the storm, as workplace outbreaks grow Closures have silenced bars, restaurants and entertainment venues in New York City, Houston, Chicago, D.C. and the Bay Area in recent days.;17;28
The Washington Post;@washingtonpost;2021-12-23T19:49:05.000Z;Booster shots crushed Israel’s delta wave. It’s betting a fourth dose will do the same to omicron. Israeli health officials say they don't have time to wait for studies on omicron before recommending another booster.;22;62
The Washington Post;@washingtonpost;2021-12-23T17:41:02.000Z;A UPS driver left a kind message for a family. They put it on Instagram, and strangers showered the... “They just have been coming in abundance — mostly from strangers,” UPS driver Dallen Harrell said of the gifts.;22;176
The Washington Post Retweeted;@joyceslee;2021-12-23T17:29:43.000Z;‘Burn it all down’: How Myanmar’s military razed villages to crush a growing resistance Exclusive documents and imagery reveal how Myanmar's military planned and executed a scorched-earth campaign, burning villages and shooting civilians, in restive Chin state.;4;114
The Washington Post;@washingtonpost;2021-12-23T17:21:08.000Z;Joan Didion, who chronicled American decadence and hypocrisy, dies at 87 Her novels and essays explored the agitated, fractured state of the nation’s psyche.;11;196
The Washington Post;@washingtonpost;2021-12-23T17:14:47.000Z;Trump asks Supreme Court to keep records from House Jan. 6 committee Trump wants the justices to reverse a unanimous ruling from the U.S. Court of Appeals for the D.C. Circuit, which rejected his assertions of executive privilege and request to keep secret roughly 800...;142;51
The Washington Post Retweeted;@mboorstein;2021-12-23T16:40:22.000Z;Cancel the pageant? The children’s service? Churches face painful Christmas questions amid new... What should be cancelled and what should continue, and how, were the quandaries facing church staff at congregations huge and tiny all over the country this week.;3;10
The Washington Post;@washingtonpost;2021-12-23T17:05:05.000Z;Federal Election Commission dismisses complaints against DeJoy over alleged straw-donor scheme In a decision that was made public this week, the FEC voted 4-1 to dismiss the complaints. against the postmaster general.;20;30
The Washington Post;@washingtonpost;2021-12-23T17:02:03.000Z;Trump’s newest business partner: A Chinese firm with a history of SEC investigations Shanghai-based Arc Capital, an investment firm that has been the target of probes by securities regulators, is at the center of the deal to take Trump’s media venture public.;44;80
The Washington Post;@washingtonpost;2021-12-23T14:34:09.000Z;FDA authorizes Merck’s anti-coronavirus pill, a second treatment option Merck's anti-covid pill, molnupiravir, was authorized by federal regulators a day after Pfizer's pill received a green light. Molnupiravir carries risks, but with treatments in short supply, it may...;34;133
The Washington Post;@washingtonpost;2021-12-23T14:31:07.000Z;Covid-19 live updates: Driven by omicron, U.S. cases surpass summer delta peak Coronavirus-related hospitalizations have continued rising in the United States.;18;26
The Washington Post;@washingtonpost;2021-12-23T14:05:18.000Z;Amid Ukraine invasion scare, U.S. and Europe lean on sanctions threat to stop Putin The United States has marshaled support from its European allies for significant sanctions but heavy reliance on economic measures faces challenges and limitations.;47;48
The Washington Post;@washingtonpost;2021-12-23T13:37:10.000Z;"Thursday briefing: New covid pill; easing omicron wave; student loan pause; NASA’s telescope... Catch up in minutes with these 7 stories.";9;13
The Washington Post;@washingtonpost;2021-12-23T13:27:34.000Z;NASA’s James Webb Space Telescope, poised to launch, will open a new window on the cosmos — if... The successor to the Hubble must evade 344 “single point failures” to achieve its ambitious mission.;5;35
The Washington Post;@washingtonpost;2021-12-23T12:35:17.000Z;As the GOP sheds its moderates, a whirlwind approaches We are entering a dark era of turbulence and division.;85;100
The Washington Post;@washingtonpost;2021-12-23T12:07:01.000Z;Kamala Harris tests negative after coronavirus exposure, spokesperson says The vice president's exposure comes days after President Biden had close contact with a “mid-level staffer” who later tested positive.;53;43
The Washington Post;@washingtonpost;2021-12-23T08:31:15.000Z;An 18-year-old woman is helping change the face — and speed — of sailing CJ Perez’s abundant talent and expertise at foiling has landed her in SailGP, a top-level league that wants to create more opportunities in the sport for women and members of other underrepresented...;11;20
The Washington Post;@washingtonpost;2021-12-23T08:15:30.000Z;TikTok’s new food-delivery brand plans to bring feta pasta and smash burgers to your door TikTok is partnering with a ghost kitchen service to bring recipes made popular on the app to your door.;7;12
The Washington Post;@washingtonpost;2021-12-23T07:58:53.000Z;The Seahawks’ reign as an NFL power is over, and it’s ending in a whimper The Seattle Seahawks' season spiraled further as they clinched the first losing season of Russell Wilson's career, an unwanted milestone that feels more like the end of the road than a bump in it.;6;9
The Washington Post;@washingtonpost;2021-12-23T07:39:09.000Z;Mysteries continue as officials struggle to open apparent time capsule found under Lee monument;16;32
The Washington Post;@washingtonpost;2021-12-23T07:22:58.000Z;Alan Scott, researcher who pioneered medical uses of Botox, dies at 89 Botox, the drug he first used to treat conditions such as crossed eyes, went on to be used by an estimated 11 million people as a wrinkle-relaxing elixir of youth.;16;24
The Washington Post;@washingtonpost;2021-12-23T07:07:03.000Z;First came the TikTok school shooting ‘challenge.’ Then came the fear. Are you not reassured?;7;21
The Washington Post;@washingtonpost;2021-12-23T06:51:19.000Z;Carolyn Hax: Aging father keeps doing house projects. How to get him to ‘sit still’? Adult child moves in with 70ish-year-old parents and grows frustrated with father's refusal to quit projects like lawnmowing and gutter-cleaning.;8;14
The Washington Post;@washingtonpost;2021-12-23T06:32:04.000Z;It’s the holiday season: Let us help you finalize menu with sweet and savory dishes Send in your questions to The Washington Post Food team, and we’ll help solve your cooking quandaries and share our latest recipes.;7;10
The Washington Post;@washingtonpost;2021-12-23T06:15:18.000Z;UCLA, Columbia, Duke among colleges planning to start January with remote instruction as omicron... Major universities including Columbia, Duke and the University of California at Los Angeles are among a growing number of colleges choosing a temporary pivot online as coronavirus cases rise.;20;59
The Washington Post;@washingtonpost;2021-12-23T03:07:53.000Z;Omicron may be on your next flight. Here’s how to protect yourself. From wearing the right mask to boarding last, these tips can help you escape omicron on a plane.;21;45
The Washington Post;@washingtonpost;2021-12-23T02:47:56.000Z;At a Christmas card exchange, a man admitted to killing his brother and pregnant sister-in-law,... Brent Hanson told the police chief he’d attacked his brother with a baseball bat on Sunday and then slashed his sister-in-law with a machete the following morning, according to a probable cause...;13;41
The Washington Post;@washingtonpost;2021-12-23T02:29:00.000Z;Biden says he will run for reelection in 2024 if he’s ‘in good health’ The president, confirming his past comment that he would seek eight years in the White House, said he would run again if his health did not deteriorate.;249;177
The Washington Post;@washingtonpost;2021-12-23T02:09:32.000Z;Women are more likely to die or be injured in car crashes. There’s a simple reason why. Many cars are not primarily designed to keep women safe. This must change. But so far, the government has refused to make it happen.;27;98
The Washington Post;@washingtonpost;2021-12-23T01:47:41.000Z;Biden says supply chain crisis didn’t materialize: ‘Gifts are being delivered, shelves are not... In a video conference with business leaders, the president touted data showing that the U.S. economy is thriving.;53;57
The Washington Post;@washingtonpost;2021-12-23T01:25:54.000Z;With Russian troops massing on the border, Ukraine’s Zelensky focuses instead on internal foes Zelensky has targeted two of Ukraine's most powerful men: Billionaires Rinat Akhmetov and Petro Poroshenko. That focus risks dividing the country at a time when U.S. officials are warning that Russia...;30;40
The Washington Post;@washingtonpost;2021-12-23T01:09:02.000Z;Dr. Wen’s advice for the holidays Omicron is now the most prevalent variant of the coronavirus in the country. But public health expert and emergency physician Leana Wen says that with a three-pronged approach — testing, vaccines and...;28;33
The Washington Post;@washingtonpost;2021-12-23T00:57:04.000Z;Amazon warehouse workers in New York are taking another stab at forming a union Amazon workers at a major warehouse in Staten Island, N.Y., said they would re-file their petition to form a union. The group withdrew its application last month after the National Labor Relations...;11;39
The Washington Post;@washingtonpost;2021-12-23T00:50:05.000Z;Hong Kong tears down ‘Pillar of Shame’ sculpture honoring Tiananmen victims The artwork's removal underscored the dramatic political changes in the city, where authorities have sharply curtailed freedom of expression since China imposed a harsh security law last year.;90;716
The Washington Post;@washingtonpost;2021-12-22T23:10:06.000Z;Ted Kaczynski, the 79-year-old Unabomber, transferred to prison medical facility Kaczynski had been serving multiple life sentences at a supermax facility in Colorado.;29;68
The Washington Post;@washingtonpost;2021-12-22T22:57:36.000Z;How the left forced Biden’s hand on student loans A test of progressives' ability to get the president to change his mind.;43;30
The Washington Post;@washingtonpost;2021-12-22T22:37:03.000Z;Abortion providers seek quick resolution in challenge to restrictive Texas law Abortion rights advocates want the case resolved by a judge who previously blocked S.B. 8, which bans the procedure after six weeks of pregnancy.;33;54
The Washington Post;@washingtonpost;2021-12-22T22:18:37.000Z;Democratic push on voting rights becomes more urgent as midterms approach But passing a measure to outlaw partisan gerrymandering could cause a new kind of chaos.;59;55
The Washington Post;@washingtonpost;2021-12-22T21:59:45.000Z;Since October 2020, Durham has spent $3.8 million probing Russia investigation Justice Department report tracks costs of investigation since John Durham named special counsel.;119;46
The Washington Post;@washingtonpost;2021-12-22T21:41:43.000Z;How one health reporter cut through the noise on omicron Through two years of covid, Dan Diamond had written it all before. But a new way of talking about the new variant connected with a confused and jaded readership.;36;12
The Washington Post Retweeted;@jdawsey1;2021-12-22T19:22:04.000Z;Inside the nonstop pressure campaign by Trump allies to get election officials to revisit the 2020... Well-funded allies of the former president have gained audiences with top state officials to push for examinations of the vote, and local residents have bombarded election administrators with their...;103;459
The Washington Post;@washingtonpost;2021-12-22T20:30:06.000Z;Mexico’s wheat fields help feed the world. They’re also releasing a dangerous greenhouse gas. Farmers in the Yaqui Valley are driven to over-fertilize their crops, resulting in an explosion of nitrous oxide emissions with deadly and invisible consequences.;3;11
The Washington Post;@washingtonpost;2021-12-22T20:26:18.000Z;Proud Boy pleads guilty to felony charge in Capitol riot Matthew Greene is the first member of the group to plead guilty to a felony charge and agree to cooperate with the government.;36;116
The Washington Post;@washingtonpost;2021-12-22T20:23:17.000Z;Emerging scientific evidence suggests that Mexico’s emissions of nitrous oxide are significantly underestimated — emissions may be double or even quadruple what the country reports. It’s a problem that the Mexican government acknowledged to The Post.;5;21
The Washington Post;@washingtonpost;2021-12-22T20:26:03.000Z;Without regulation, the fight against nitrous oxide pollution is left to people such as Iván Ortiz-Monasterio, a 63-year-old agronomist from Cuernavaca who has spent his career trying to convince farmers to use nitrogen more efficiently.;5;10
The Washington Post;@washingtonpost;2021-12-22T20:19:10.000Z;‘The King’s Man’ movie review: Comic book meets history book Matthew Vaughn’s spy movie prequel paints a hallucinogenic history of World War I.;4;9
The Washington Post;@washingtonpost;2021-12-22T20:15:07.000Z;What happens each fall in this valley underscores how difficult it is to even track these emissions accurately, let alone stop them.;4;5
The Washington Post;@washingtonpost;2021-12-22T19:59:39.000Z;Libya postpones presidential election at last minute amid renewed threat of civil unrest No new date has been set for the election which features several controversial candidates.;5;14
The Washington Post;@washingtonpost;2021-12-22T18:21:05.000Z;Omicron ‘is going to find you,’ Fauci says in warning to the unvaccinated His comments come as many Americans are flooding pharmacies and test centers for shots and at-home test kits ahead of the Christmas holiday.;123;122
The Washington Post Retweeted;@capitalweather;2021-12-22T18:08:20.000Z;December tornado record crushed by historic onslaught of storms in U.S. The outburst of severe weather seen this month would be unusual at any time of year.;5;46
The Washington Post;@washingtonpost;2021-12-22T18:07:14.000Z;U.K.’s top archbishop says getting a coronavirus vaccination is a moral issue: ‘It’s how we love... Archbishop of Canterbury Justin Welby urged Brits to get the vaccine and the booster, noting it was a moral issue.;91;328
The Washington Post;@washingtonpost;2021-12-22T17:51:41.000Z;Long before embracing Trump’s false election claims, Rep. Scott Perry promoted groundless theories The bipartisan House panel investigating the Jan. 6 attack on the Capitol is examining Perry’s role in trying to overturn the results of the 2020 election.;40;74
The Washington Post Retweeted;@luivelarde;2021-12-22T17:48:47.000Z;Omicron is the fifth coronavirus variant on concern and is spreading rapidly around the world. Here’s what we know. youtube.com How is omicron reshaping the pandemic Omicron is the fifth coronavirus variant on concern and is spreading rapidly around the world. Here’s what we know. Read more: Subsc...;11;18
The Washington Post;@washingtonpost;2021-12-22T17:36:32.000Z;States rushed to loosen alcohol laws in the pandemic. Heavy drinking went up, some studies say. Seeking to help restaurants, brewers and distillers, dozens of states have made it easier to bring alcohol home since 2020.;28;41
The Washington Post;@washingtonpost;2021-12-22T17:34:57.000Z;Biden administration to extend student loan pause until May A moratorium was scheduled to expire early in 2022.;70;223
The Washington Post;@washingtonpost;2021-12-22T17:25:29.000Z;FDA authorizes Pfizer’s anti-covid pill as omicron surges The supply of Paxlovid will be limited initially, even as demand is expected to soar.;33;119
The Washington Post;@washingtonpost;2021-12-22T17:17:39.000Z;"‘With Love’ is the rare feel-good holiday show that actually feels good In ""With Love,"" ""One Day at a Time"" co-creator Gloria Calderon Kellett's new Amazon series, a multigenerational Latinx family comes together on the holidays.";7;15
The Washington Post;@washingtonpost;2021-12-22T15:08:18.000Z;Biden aides see March 2021 rescue package as initial economic buffer against omicron Restaurants are closing and people are cancelling plans because of the virus’s latest surge, but the White House doesn’t see the need for a big cash infusion - yet.;12;27
The Washington Post;@washingtonpost;2021-12-22T15:07:30.000Z;Israel says it will become first nation to offer fourth coronavirus vaccine dose: ‘The world will... Amid concerns about the omicron variant, citizens 60 and older and other at-risk groups will be eligible.;88;192
The Washington Post;@washingtonpost;2021-12-22T15:06:41.000Z;"Harvard chemistry professor found guilty of hiding ties to China Charles Lieber's conviction is a victory for the U.S. Justice Department's initiative against ""economic espionage.""";28;125
The Washington Post;@washingtonpost;2021-12-22T15:05:42.000Z;While omicron explodes around the world, covid cases in Japan keep plummeting and no one knows... Even neighboring South Korea is seeing a surge in cases, but in Japan every day only brings a handful of new infections.;90;102
The Washington Post;@washingtonpost;2021-12-22T15:04:57.000Z;Military families say they were ill months before jet-fuel leak brought scrutiny to Pearl Harbor’s... As U.S. military officials have scrambled to address a public health crisis stemming from the discovery of jet fuel in the tap water supply at Joint Base Pearl Harbor-Hickam in Hawaii, multiple...;7;23
The Washington Post;@washingtonpost;2021-12-22T15:04:55.000Z;Kim Potter saw Daunte Wright clearly. But belatedly. In all the chaos and panic, the former police officer saw what she had done. She had killed a boy.;18;9
The Washington Post;@washingtonpost;2021-12-22T12:04:02.000Z;Covid-19 live updates: U.S. life expectancy, population growth drop as pandemic heads into third... Covid-19 is the third-leading cause of death in the United States, behind heart disease and cancer.;33;68
The Washington Post;@washingtonpost;2021-12-22T11:48:31.000Z;Americans widely distrust Facebook, TikTok and Instagram with their data, poll finds Pulled between not trusting some tech companies and still wanting to use their products, people look to government regulation.;48;123
The Washington Post;@washingtonpost;2021-12-22T11:48:09.000Z;Black girls are more apt to drop out of sports. This mentorship program aims to change that. A partnership between Voice in Sport and the NWSL’s Black Women’s Player Collective helps pair young athletes with mentors who look like them.;15;40
The Washington Post;@washingtonpost;2021-12-22T08:38:36.000Z;Dear Republicans: Trump wants you to get vaccinated Recapping the former presidents various comments on the subject.;102;39
The Washington Post;@washingtonpost;2021-12-22T08:23:00.000Z;"Carolyn Hax: Wife starts a business; husband starts to crack under financial pressure He feels resentful that their family’s financial security is falling exclusively on his shoulders as his wife starts her new business.";3;15
The Washington Post;@washingtonpost;2021-12-22T08:04:04.000Z;Climate change is the greatest threat to humanity. Here’s how filmmakers have tried to make sense... Over the past 20 years, directors have increasingly put out movies that help viewers process climate change fears.;51;44
The Washington Post;@washingtonpost;2021-12-22T07:45:37.000Z;At least 69 D.C. residents died in 2021 ‘without the dignity of a home’ An annual memorial service honored homeless people who perished on Washington's streets.;22;61
The Washington Post;@washingtonpost;2021-12-22T07:27:20.000Z;It’s time to start requiring booster shots Employers and other private actors shouldn't wait for guidance from the CDC.;92;383
The Washington Post;@washingtonpost;2021-12-22T07:11:29.000Z;Every tech support task you should do for your family this week Everything tech-savvy relatives should do for their more analog family members while visiting over the holidays.;8;14
The Washington Post;@washingtonpost;2021-12-22T06:52:49.000Z;Football biopic ‘American Underdog’ plays it safe, but effective Zachary Levi stars as Kurt Warner, in a film that follow the quarterback’s story from stocking shelves to the Super Bowl.;8;7
The Washington Post;@washingtonpost;2021-12-22T06:33:40.000Z;Rescued sea turtles to undergo rehab at National Aquarium in Maryland Official said the turtles rescued from Cape Cod, Mass., include 26 of the Kemp’s ridley species and four green sea turtles. Conservation groups consider both species endangered.;9;48
The Washington Post;@washingtonpost;2021-12-22T06:14:06.000Z;U.S. life expectancy fell again in 2020 as the pandemic took a heavy toll Covid-19 became the third-leading cause of death in the United States, behind heart disease and cancer.;26;84
The Washington Post;@washingtonpost;2021-12-22T03:30:37.000Z;A model for how to spend federal money on early education already exists The Early Head Start-Child Care Partnership has supported local child-care programs for years. Lawmakers can learn from it for the Build Back Better act.;6;28
The Washington Post;@washingtonpost;2021-12-22T03:10:12.000Z;‘Red Rocket’ movie review: cultural voyeurism masquerading as compassion Sean Baker’s latest film follows a washed-up-porn star at the dawn of Trumpism.;3;5
The Washington Post;@washingtonpost;2021-12-22T02:48:31.000Z;How to make holiday flights less stressful, according to flight attendants Packing advice, airport insights, and why you should bring a gift card or two for cabin crew.;9;15
The Washington Post;@washingtonpost;2021-12-22T02:26:48.000Z;‘The Matrix Resurrections’ is trapped inside its own endless feedback loop The fourth chapter in the sci-fi franchise recycles the first three films, to ill effect.;18;17
The Washington Post;@washingtonpost;2021-12-22T02:05:03.000Z;Supply-chain issues and a cyberattack: Why your bagel’s cream cheese might be spread a little thin The shortage of cream cheese is the latest supply issue to hit during the coronavirus pandemic. But it seems to have hit a particular nerve, capping a year of dashed hopes for a return to normal.;23;19
The Washington Post;@washingtonpost;2021-12-22T01:44:34.000Z;Overnight cranberry rolls with cream cheese frosting make for festive mornings The dough for these cranberry swirl rolls is enriched with cream cheese before it's wrapped around a tart fruity filling. Cream cheese frosting adds extra fluff.;19;22
The Washington Post;@washingtonpost;2021-12-22T01:14:06.000Z;‘I know my parents love me, but they don’t love my people’ Transracial adoptees, children raised by adoptive parents of a different race or ethnicity, are experiencing their own racial reckoning as the nation confronts its historical scars.;46;51
The Washington Post;@washingtonpost;2021-12-22T00:57:39.000Z;Frodo, the last surviving dog rescued from Michael Vick, dies surrounded by loved ones Forty-eight dogs were rescued from the quarterback's dogfighting operation in 2007 and their everyday lives life became a testament to the power of rehabilitation.;27;118
The Washington Post;@washingtonpost;2021-12-21T22:01:58.000Z;NHL players won’t go to the Beijing Olympics after coronavirus spike disrupts schedule The league's players will not be allowed to participate in the second consecutive Winter Game, following a spike in positive cases that has led to the postponement of 50 regular-season games.;37;173
The Washington Post;@washingtonpost;2021-12-21T21:58:08.000Z;Why Spider-Man’s lawyer in ‘No Way Home’ is such a big deal Spider-Man and Doctor Strange aren’t the only superheroes in “No Way Home.”;13;28
The Washington Post;@washingtonpost;2021-12-21T21:45:39.000Z;When Trump has told his supporters to get vaccinated At various points in 2021, former president Donald Trump has encouraged his supporters to get vaccinated against the coronavirus.;106;39
The Washington Post;@washingtonpost;2021-12-21T21:32:36.000Z;Early use of convalescent plasma reduced hospitalizations, raising hopes for treating omicron... The treatment, which contains a bounty of disease-fighting antibodies, could expand doctors’ repertoire for fighting the increasingly dominant variant that resists many treatments.;12;21
The Washington Post;@washingtonpost;2021-12-21T21:19:29.000Z;Tom Sietsema’s 7 favorite places to eat right now A toast to some favorite newcomers, as well as a few tried-and-true performers.;5;13
The Washington Post;@washingtonpost;2021-12-21T21:12:41.000Z;Bureau of Prisons can keep inmates in home confinement after coronavirus emergency ends Department of Justice ruling could allow thousands to stay out of prison, continue reintegrating into society.;37;71
The Washington Post;@washingtonpost;2021-12-21T21:03:01.000Z;Enter winter, the fastest-warming season Temperatures have hastily risen throughout the U.S., disrupting nature’s normal rhythms;31;40
