Pinned Tweet;@washingtonpost;2021-12-07T22:16:24.000Z;In the middle of the 19th century, hundreds of thousands of new Americans flooded into New York. They found homes in buildings like this one, on Orchard Street on Manhattan’s Lower East Side.;667;445
The Washington Post;@washingtonpost;2021-12-27T18:12:33.000Z;"Somalia’s election standoff intensifies, raising risk of political violence Mohamed Abdullahi ""Farmajo"" Mohamed, Somalia's president, attempted to sideline his main rival, Prime Minister Mohamed Hussein Roble, by suspending his powers.";11;14
The Washington Post;@washingtonpost;2021-12-27T17:54:37.000Z;2021 was a huge year for space exploration. 2022 could be even bigger. 2022 could be marked by the first steps toward a return to the moon.;14;14
The Washington Post;@washingtonpost;2021-12-27T15:14:04.000Z;More coronavirus tests will be available next month, Fauci says, as U.S. struggles with shortage As the omicron variant fuels a surge, “we’ve obviously got to do better” on testing availability, infectious-disease expert Anthony S. Fauci said.;67;48
The Washington Post;@washingtonpost;2021-12-27T15:04:06.000Z;Covid-19 live updates: Omicron drives new cases to record levels around the world U.S. health officials warn that the country could soon see more than 1 million new cases per day, far beyond last winter’s peak of 248,000.;14;42
The Washington Post;@washingtonpost;2021-12-27T14:48:39.000Z;Men across America are getting vasectomies ‘as an act of love’ Some men say they want to take a greater role in family planning, especially at a time when they say women are shouldering so much of the reproductive-rights fight.;116;100
The Washington Post;@washingtonpost;2021-12-27T14:33:04.000Z;House MAGA squad seeks to expand by boosting challengers to fellow Republicans The defiant cadre most loyal to the former president is boosting those who hew to Trump’s false claims that the election was rigged against him.;31;22
The Washington Post;@washingtonpost;2021-12-27T14:12:23.000Z;The ‘Let’s Go Brandon’ Oregonian, a New York judge and the true meaning of the First... Two otherwise unconnected Christmas week episodes — one involving an insult to President Biden, the other Project Veritas and the New York Times — bring freedom of speech to the forefront.;29;22
The Washington Post;@washingtonpost;2021-12-27T13:51:39.000Z;How to build a charcuterie board A complete guide on how to build a charcuterie board, including what foods to include, how much to buy, and other tips for maximum enjoyment.;31;23
The Washington Post;@washingtonpost;2021-12-27T13:31:06.000Z;From airport WiFi to ‘juice jacking’: 7 ways to protect your data when traveling Travel can be full of cybercrime land mines. Here are expert tips to avoid them.;7;28
The Washington Post;@washingtonpost;2021-12-27T12:56:38.000Z;Carolyn Hax: Is it okay to meet up with a male friend and not tell your jealous... A letter-writer wonders if it's okay to keep plans with a male college friend, and keep a jealous boyfriend in the dark.;52;24
The Washington Post;@washingtonpost;2021-12-27T12:21:38.000Z;At least 16 people killed in shipwreck off Greece, adding to string of deadly incidents at sea At least 14 people died and many more remained missing in two other maritime disasters near Greece this week.;15;26
The Washington Post;@washingtonpost;2021-12-27T07:30:23.000Z;"USDA accuses dog breeding facility in Virginia of mistreating animals An unannounced USDA inspection at the massive beagle-breeding facility found dozens of violations: records indicating hundreds of puppies had died of “unknown causes” over a span of months; food...";16;69
The Washington Post;@washingtonpost;2021-12-27T06:53:38.000Z;More Australians are paying tribute to Indigenous people. Some worry it’s just lip service. Many Indigenous leaders say the trend is a step toward recognizing the dispossession of Aboriginal people. Others fear the practice has become a Band-Aid, hiding wounds in need of surgery.;26;37
The Washington Post;@washingtonpost;2021-12-27T06:19:15.000Z;As a single mother, I lost my job before Christmas. I don’t believe in miracles, but... I wasn't just a single parent, I was the only parent. My paycheck was survival.;26;49
The Washington Post;@washingtonpost;2021-12-27T05:44:22.000Z;Native Americans’ farming practices may help feed a warming world “We’ve had 5,000 years of farmers trying out different strategies for dealing with heat, drought and water scarcity. We need to begin to translate that,” said one ethnobotanist in the region.;23;156
The Washington Post;@washingtonpost;2021-12-27T05:11:20.000Z;Democrats’ 2022 choice: Govern or lose Democrats have a narrow window to get a lot done. They can’t afford to indulge in recriminations.;49;57
The Washington Post;@washingtonpost;2021-12-27T04:36:20.000Z;A new map gives Democrats a shot on Maryland’s Eastern Shore. Three are vying for a chance to oust... Former Maryland delegate Heather Mizeur, who previously represented Takoma Park, is leading the Democratic field in fundraising. Her opponents, Dave Harden and Jennifer Pingley, say she's not the...;22;42
The Washington Post;@washingtonpost;2021-12-27T04:02:14.000Z;Why this is still the most wonderful time of the year Christmas is for its own sake.;10;16
The Washington Post;@washingtonpost;2021-12-27T03:24:03.000Z;Many home insurance premiums are rising faster than inflation Since 2017, premium rates are up 11.4 percent on average because of supply chain issues and climate change.;20;40
The Washington Post;@washingtonpost;2021-12-27T03:11:09.000Z;At-home covid tests and omicron: What you need to know At-home coronavirus tests are becoming scarce amid the omicron surge. Here's where to look, and what to do if you can’t find one.;22;27
The Washington Post;@washingtonpost;2021-12-26T23:17:34.000Z;With omicron, it may be harder to tell if you have covid, the common cold or flu A handful of factors are contributing to the blurring of symptoms among viruses, including omicron’s characteristics, the way symptoms present in vaccinated people and the rise in cold and flu cases...;121;279
The Washington Post;@washingtonpost;2021-12-26T22:41:51.000Z;Kansas’s prairie is rapidly shrinking. Its future depends on private landowners like Lorna Harder. How she’s trying to save the vital ecosystem, acre by acre.;13;30
The Washington Post;@washingtonpost;2021-12-26T22:05:15.000Z;6 ham recipes that make the most of leftovers for breakfast, lunch or dinner These recipes for leftover ham include grilled cheese, soup and even a savory cake.;12;18
The Washington Post;@washingtonpost;2021-12-26T21:18:10.000Z;The first Christmas as a layperson: Burned out by the pandemic, many clergy quit in the past year Between fights about masks to how far religious leaders can go in expressing political views, pastoral burnout has been high.;28;25
The Washington Post;@washingtonpost;2021-12-26T20:42:42.000Z;Military Bowl canceled after spike in coronavirus cases among Boston College players The Eagles were to face East Carolina Monday afternoon until organizers scrapped the bowl game in Annapolis for a second straight year.;17;41
The Washington Post;@washingtonpost;2021-12-26T20:26:11.000Z;Fenway Bowl canceled after Virginia withdraws from game amid coronavirus concerns Coach Bronco Mendenhall departs the program without an official sendoff as the Cavaliers miss out on a bowl game for the second consecutive year.;15;30
The Washington Post;@washingtonpost;2021-12-26T20:08:52.000Z;‘The craziest wedding year of all time’: A photographer’s overbooked, overwhelming 2021 Long Island photographer Michael Cassara looks back on his weddings in 2021, a year of sweet, sweet delayed gratification.;6;22
The Washington Post;@washingtonpost;2021-12-26T19:31:15.000Z;In Photos: Remembering Desmond Tutu Anglican Archbishop Desmond Tutu, who won the Nobel Peace Prize for his struggle against the system of white domination known as apartheid, died Dec. 26 in Cape Town. He was 90.;52;231
The Washington Post;@washingtonpost;2021-12-26T15:15:00.000Z;"Decades later, ‘Home Alone’ fans are still casing the iconic house It’s been 31 years since Kevin McCallister battled dim-witted robbers in ""Home Alone,"" but fans keep coming to iconic suburban Chicago home.";17;50
The Washington Post;@washingtonpost;2021-12-26T15:25:00.000Z;For the tourists who come from all over the world to see the house, the visit is a chance to reenact the movie and make memories of their own.;16;48
The Washington Post;@washingtonpost;2021-12-26T15:00:24.000Z;Dave Barry’s 2021 Year in Review Vaccines, variants and supply chain woes: A look back at the past 12 months.;32;60
The Washington Post;@washingtonpost;2021-12-26T14:41:58.000Z;Broken promises cannot deter the path to Build Back Better The president’s agenda is even more urgent today.;100;138
The Washington Post;@washingtonpost;2021-12-26T14:11:46.000Z;Naomi Osaka, Simone Biles and the enduring sports message of 2021 Naomi Osaka and Simone Biles, who showed us that it's okay not to be okay, were the most important athletes in;51;81
The Washington Post;@washingtonpost;2021-12-26T13:41:30.000Z;They borrowed money to pay for college. Here’s what they would change about student loans. Student loan borrowers tell us what they would change about their debt experience and the policy that defines federal education lending.;52;53
The Washington Post;@washingtonpost;2021-12-26T12:20:30.000Z;What we learned during the pandemic about the effectiveness of cash assistance Too often, families facing challenges are forced to navigate a confusing network of service providers to access resources.;16;23
The Washington Post;@washingtonpost;2021-12-26T11:47:55.000Z;The Slackers are the ska stalwarts who keep on going Back on the road after a pandemic pause, the band celebrates 30 years with a fan base that follows it every step of the way.;12;15
The Washington Post;@washingtonpost;2021-12-26T11:15:44.000Z;For five Jakes, Taylor Swift’s ‘All Too Well’ will become their soundtrack to travel A contest awards a $300 credit to the namesakes of the reputed heartbreaker in her hit song.;10;18
The Washington Post;@washingtonpost;2021-12-26T06:05:09.000Z;Please get the vaccine. And try to understand those who won’t. The coronavirus vaccine is now just another issue that divides us. 1.2K;1200;332
The Washington Post;@washingtonpost;2021-12-26T05:34:36.000Z;Anger over masks mandates, other covid rules, spurs states to curb power of public health officials A flurry of new laws restrict the authority of state or local health officers to take steps proven to help safeguard the public’s health.;181;128
The Washington Post;@washingtonpost;2021-12-26T05:04:04.000Z;We’re adapting to living with covid-19 — less so to accepting uncertainty The public’s demand for easy answers during the pandemic has not been conducive to good information.;31;31
The Washington Post;@washingtonpost;2021-12-26T04:32:02.000Z;What to watch in NFL Week 16: Playoff implications almost everywhere you look The Patriots face the Bills and the Bengals face the Ravens on Sunday in two massive divisional games.;8;15
The Washington Post;@washingtonpost;2021-12-26T03:58:58.000Z;The mob killing of a foreign factory manager in Pakistan comes amid surge in anti-blasphemy violence This religious crusade is rapidly gaining popular support and could threaten the country’s stability.;9;19
The Washington Post;@washingtonpost;2021-12-26T03:26:20.000Z;Five myths about the Arctic No, it’s not ‘empty’ or cut off from the rest of the world.;5;33
The Washington Post;@washingtonpost;2021-12-26T02:53:00.000Z;In their shared sea, Ukraine and Russia already risk direct conflict every day The Sea of Azov, the world's shallowest sea, is considered shared territory between Ukraine and Russia. It renders Ukrainian cities vulnerable to amphibious invasion.;28;47
The Washington Post;@washingtonpost;2021-12-26T02:22:24.000Z;Sheet-pan Peruvian pollo a la brasa captures the flavor of fire at home Arguably Peru's most famous export, pollo a la brasa requires a rotisserie. This recipe pays homage to the original with a few tricks and a hot oven.;15;53
The Washington Post;@washingtonpost;2021-12-26T01:49:53.000Z;"Jane Campion’s masterful ‘Power of the Dog’ had a fascinating and much maligned precursor ""Power of the Dog"" owes a debt to Campion’s ""In the Cut,"" the film that took down Meg Ryan.";2;13
The Washington Post;@washingtonpost;2021-12-25T20:18:25.000Z;Here’s what forgiving student loans really means: A lifeline out of poverty Wiping out college debt would help Biden achieve other aims on racial equality as well.;253;225
The Washington Post;@washingtonpost;2021-12-25T19:48:15.000Z;A child calling Santa reached NORAD instead. Christmas Eve was never the same. The military's NORAD has been tracking Santa every Christmas Eve for 63 years. It all began when the command center's red phone rang and a kid was on the other end.;27;163
The Washington Post;@washingtonpost;2021-12-25T19:16:10.000Z;Coronavirus outbreak sidelines ship whose crew is fully immunized, Navy says Navy vessels, where personnel live in tight quarters while at sea, are particularly vulnerable to the coronavirus. The U.S. military’s first major coronavirus outbreak happened last year aboard the...;22;57
The Washington Post;@washingtonpost;2021-12-25T18:42:57.000Z;Britain gets a glimpse of Queen Elizabeth II in Christmas message A combination of health issues and coronavirus restrictions have kept the queen from public engagements since October.;45;73
The Washington Post;@washingtonpost;2021-12-25T18:11:55.000Z;Armed intruder apprehended on Windsor Castle grounds as queen celebrates Christmas Police arrested the 19-year-old outside the main residence of Queen Elizabeth II.;20;44
The Washington Post;@washingtonpost;2021-12-25T17:41:35.000Z;How to get refunds if your Christmas flight is canceled Omicron has impacted flight crews, leading to thousands of holiday cancellations from struggling carriers.;25;57
The Washington Post;@washingtonpost;2021-12-25T17:12:14.000Z;The viewer’s guide to making the most of the NBA’s omicron-ravaged Christmas The NBA's Christmas Day slate ranked: From a must-see Warriors-Suns matchup to a Hawks-Knicks dud;4;10
The Washington Post;@washingtonpost;2021-12-25T16:44:51.000Z;We can’t let companies wink at laws designed to keep us safe Why not require masks everywhere, no exceptions?;42;33
The Washington Post;@washingtonpost;2021-12-25T16:14:54.000Z;Video: NASA's space telescope launched on Dec. 25 and will capture light from first stars and study distant worlds.;12;95
The Washington Post;@washingtonpost;2021-12-25T12:00:06.000Z;What to watch Saturday in the NFL: Two MVP hopefuls take the field In the NFL’s Christmas Day games, Aaron Rodgers and the Packers take on the Browns, and Jonathan Taylor and the Colts face the Cardinals.;9;13
The Washington Post;@washingtonpost;2021-12-25T11:33:14.000Z;Biden is quietly erasing one of Trump’s cruelest legacies Access to health care is expanding, and onerous bureaucratic work requirements are gone.;62;151
The Washington Post;@washingtonpost;2021-12-25T11:06:39.000Z;Date Lab: Dinner seemed to last forever — and not in a good way Both were looking for a serious relationship.;7;15
The Washington Post;@washingtonpost;2021-12-25T10:40:32.000Z;Even under pre-pandemic circumstances, the end of the year presented challenges for many women: Amid all the celebrations and weighty hopes of the holidays, losses and disruptions can feel especially acute. thelily.com Finding holiday joy in a year full of losses and setbacks These three women have found that joy comes with effort — and a lot of intention.;9;15
The Washington Post;@washingtonpost;2021-12-25T10:11:56.000Z;Ukraine stood with the West in 2014. Today we must stand with Ukraine. The United States must continue to build an international coalition of partners in Europe and elsewhere who see the Russian threat with clear eyes.;51;89
The Washington Post;@washingtonpost;2021-12-25T08:50:50.000Z;"For Queen Elizabeth II, 2021 brought sorrow and scandal to the royal family She sat alone at Prince Philip's funeral and was ""saddened"" by revelations in Harry and Meghan's explosive Oprah interview.";33;47
The Washington Post;@washingtonpost;2021-12-25T08:23:45.000Z;Tourist drug demand is bringing cartel violence to Mexico’s most popular resorts The government, sensitive to several recent high-profile incidents, has deployed a Tourist Security Battalion to patrol Cancun, Tulum and the Mexican Riviera.;33;80
The Washington Post;@washingtonpost;2021-12-25T07:57:25.000Z;Many fled D.C. during pandemic, halting city’s population boom New data from the Census Bureau show the number of District residents dropped by about 20,000.;26;51
The Washington Post;@washingtonpost;2021-12-25T02:59:22.000Z;A decade’s worth of photos capture Christmas in America, from the joyful to the bleak Photographer Jesse Rieser traveled to 18 states over a decade to document Christmas's contradictions.;9;30
The Washington Post;@washingtonpost;2021-12-25T02:32:39.000Z;Major Biden’s removal from the White House has critics howling. But the first family did... The White House was not the best environment for this beloved dog.;50;54
The Washington Post;@washingtonpost;2021-12-25T01:35:05.000Z;"Omicron snarls some Christmas travel plans; 3,800 flights canceled worldwide Cancellations are modest, but ‘if your flight is the one that’s been canceled, the world has just ended,’ says analyst.";36;97
The Washington Post;@washingtonpost;2021-12-25T00:59:58.000Z;High-profile killing of military couple came after son’s dispute, witness says Edward McDaniel Jr., an Army colonel and doctor who treated generals, and his wife, Brenda, a retired Army colonel and a nurse who has served in the White House, were slain in May.;4;14
The Washington Post;@washingtonpost;2021-12-25T00:34:04.000Z;Coronavirus cases reach new highs again in D.C. area heading into Christmas holiday The D.C. region headed into the Christmas holiday in the throes of the worst coronavirus surge the area has ever witnessed, in terms of the number of people coming down with the virus.;28;50
The Washington Post;@washingtonpost;2021-12-25T00:12:49.000Z;D.C. teacher’s viral three-point shot leaves people swooning — and her students elated Kathleen Fitzpatrick's third-grade students' reaction to the stellar shot has been a salve across the Internet;16;97
The Washington Post;@washingtonpost;2021-12-24T19:40:31.000Z;Stuck inside because of the omicron variant? Here are creative ways to stay safe and sane. Health experts suggested staying active if people are feeling well enough — and exercising both body and mind.;14;20
The Washington Post;@washingtonpost;2021-12-24T19:10:50.000Z;A sticky-sweet pomegranate molasses glaze makes these meatballs ready to party Whether you make your own pomegranate molasses or not, it makes a fantastic glaze for these powerfully spiced meatballs.;8;17
The Washington Post;@washingtonpost;2021-12-24T18:42:16.000Z;More than three dozen dead, 100 injured after fire tears through crowded ferry in Bangladesh The country, reliant on river travel, has a long history of water calamities.;7;47
The Washington Post;@washingtonpost;2021-12-24T18:11:29.000Z;Financial regulator takes aim at ‘buy now, pay later’ credit The Consumer Financial Protection Bureau, now under President Biden’s control, said it's probing popular “buy now, pay later” credit products offered by Affirm, Afterpay, Klarna, PayPal and Zip.;16;37
The Washington Post;@washingtonpost;2021-12-24T17:45:33.000Z;The most popular fact checks of 2021 Fact checks concerning the coronavirus and former president Donald Trump dominated the list.;44;32
The Washington Post;@washingtonpost;2021-12-24T17:13:57.000Z;Omicron and children: Pediatric hospitals in parts of U.S. filling fast About 800 kids have been admitted nearly every day this week, with those in Ohio, Texas, Pennsylvania and New York hit particularly hard by the juggernaut variant.;43;166
The Washington Post;@washingtonpost;2021-12-24T16:47:48.000Z;"Rudy Giuliani and One America News sued by Georgia poll workers falsely accused of electoral fraud Ruby Freeman and her daughter Wandrea “Shaye” Moss allege that Giuliani and the far-right network knowingly spread misinformation that led to ""vitriol, threats, and harassment.""";150;521
The Washington Post;@washingtonpost;2021-12-24T15:50:04.000Z;Google hit with $100 million fine in Russia for ‘systematic failure to remove banned content’ The penalty, the largest yet by Russia, represents an escalation in Russia’s push to pressure foreign tech firms to comply with its increasingly strict rules for the internet.;31;72
The Washington Post;@washingtonpost;2021-12-24T13:01:55.000Z;Apple’s AirTags can be as creepy as they are helpful. Finding them with some phones is easier than... Hopefully, no one is using one of Apple's AirTags to track your location. But it’s important to know what to do, just in case.;8;19
The Washington Post;@washingtonpost;2021-12-24T12:39:01.000Z;"What makes a diner tip $10,000? Servers spill their secrets. As one server who has earned large tips says, some customers ""give back financially what they've been given emotionally.""";20;14
The Washington Post;@washingtonpost;2021-12-24T12:11:39.000Z;The Navy SEALs, a Christmas story As the SEALs reinvented themselves, they focused on new missions for a world where counterterrorism is no longer the overriding priority.;28;34
The Washington Post;@washingtonpost;2021-12-24T11:44:05.000Z;Police arrest suspect in fatal shooting during flag football game on Capitol Hill The shooting came after a game marred by tension and trash-talk, court papers say;11;22
The Washington Post;@washingtonpost;2021-12-24T11:14:34.000Z;Supreme Court cases over vaccine mandates are really about whether government can protect... Can federal agencies impose mandates using laws that were not designed with a global pandemic in mind?;29;30
The Washington Post;@washingtonpost;2021-12-24T10:22:10.000Z;"‘Emily in Paris’ is exactly as bad as you remember, which is perfect Lily Collins's character remains vapid as ever in Season 2 of ""Emily in Paris,"" released Dec. 22 on Netflix.";18;30
The Washington Post;@washingtonpost;2021-12-24T09:54:09.000Z;A teen found a way to ease her anxiety and despair: Give away thousands of books to sick children Since the summer, Emily Bhatnagar has collected more than 7,000 books.;17;133
The Washington Post;@washingtonpost;2021-12-24T09:28:05.000Z;Immune cells mean omicron won’t swamp hospitals in vaccinated areas In highly vaccinated L.A. County, we don't expect a repeat of last year.;20;37
The Washington Post;@washingtonpost;2021-12-24T05:00:31.000Z;The most anticipated video games of 2022 Delays in 2021 have only served to add to hype for 2022.;8;15
The Washington Post;@washingtonpost;2021-12-24T04:34:05.000Z;Inside the administration’s failure to avert a covid testing shortfall The administration focused on testing early on as a key element in returning the country to normal. But over time, its emphasis shifted sharply to vaccines.;22;24
The Washington Post;@washingtonpost;2021-12-24T04:25:05.000Z;Stop shaming people for getting covid. Blame belongs elsewhere. We must look harder at large-scale things the government and the private sector haven’t done that would help.;22;23
The Washington Post;@washingtonpost;2021-12-24T03:53:04.000Z;Ted Cruz doesn’t realize the Republican nomination pipeline is already broken Yes, the Republican nominee used to be the prior contest's runner-up. But not recently.;55;36
The Washington Post;@washingtonpost;2021-12-24T03:27:31.000Z;The most dangerous conservative judges aren’t on the Supreme Court Three trends emanating from lower-court Republican judges are particularly threatening to our system of democratic governance.;27;62
The Washington Post;@washingtonpost;2021-12-24T02:57:30.000Z;‘A woman is a woman, a man is a man’: Putin compares gender nonconformity to the coronavirus... Putin has frequently used public appearances to take conservative position on culture war issues that he sees as Western, liberal viruses spreading in Russian society.;568;439
The Washington Post;@washingtonpost;2021-12-24T02:28:06.000Z;It is still Trump’s base that most needs to be convinced to get vaccinated A year into coronavirus vaccinations, the central point of resistance is clear.;65;45
The Washington Post;@washingtonpost;2021-12-24T02:09:02.000Z;Jury asks court to hear recordings of Elizabeth Holmes speaking with investors on third full day of... The jury in the Elizabeth Holmes trial is on its third full day of deliberations.;11;27
The Washington Post;@washingtonpost;2021-12-24T02:03:54.000Z;Portraits from inside the wild, messy, overheating and confounding economy of 2021 Americans experienced highs and lows that were unique to the incredible disruption of pandemic life.;7;14
The Washington Post;@washingtonpost;2021-12-23T22:02:10.000Z;The problem with performative centrism Enough with the “let me show how not liberal I am” performances from powerful elites. Our democracy is at stake.;59;137
The Washington Post;@washingtonpost;2021-12-23T21:42:00.000Z;International students’ holiday gift: A break spent in their dorms With the pandemic complicating international travel, some students were worried about where to stay when their campuses emptied out for winter break.;6;18
The Washington Post;@washingtonpost;2021-12-23T21:24:35.000Z;James Franco speaks out about sexual misconduct allegations: ‘I did sleep with students’ Months after settling a sexual misconduct lawsuit, James Franco said he has been “doing a lot of work” on himself.;29;30
